{
"schema": "aurum.container-profile",
"version": 1,
"profile": "go-unit-offline-v1",
"lock": ".board/locks/oci/go-unit-offline-v1.lock.json",
"lock_digest": "sha256:cabe242b25bd6944e00a3ff71aa6f047585664a88ff1fc10d95f185336ffac52",
"network": "none",
"user": "65534:65534",
"cap_drop": "ALL",
"cap_add": "none",
"mounts": "none",
"devices": "none",
"pull": "never",
"tmpfs": "rw,nosuid,nodev",
"read_only_rootfs": true,
"no_new_privileges": true,
"privileged": false,
"timeout_seconds": 600,
"memory_mb": 2048,
"cpu_millis": 2000,
"pids_limit": 512,
"tmpfs_mb": 512,
"stdout_limit_bytes": 65536,
"stderr_limit_bytes": 65536,
"max_input_files": 10000,
"max_input_bytes": 67108864
}
